<?xml version="1.0" encoding="utf-8" ?>
<!DOCTYPE rpc [
    <!ELEMENT rpc (comments|methods)*>
    <!ELEMENT comments (comment)*>
    <!ELEMENT comment (#PCDATA)>
    <!ELEMENT methods (method)*>
    <!ELEMENT method (comment|errors)*>
    <!ATTLIST method
        name CDATA #REQUIRED
        param CDATA #REQUIRED
        returnType CDATA #REQUIRED>
    <!ELEMENT errors (error)*>
    <!ELEMENT error (#PCDATA)>
    <!ATTLIST error
        value CDATA #REQUIRED>
    ]>
<rpc>
    <comments>
        <comment>Allows you to interact with accounts on the aion network and provides a handful of
            crypto utilities
        </comment>
    </comments>
    <methods>
        <method name="personal_ecRecover" param="ecRecoverParams" returnType="address">
            <comment>Returns the key used to sign an input string.</comment>
        </method>
        <method name="getseed" param="voidParams" returnType="data_hex_string">
            <errors>
                <error value="UnsupportedUnityFeature"/>
            </errors>
        </method>
        <method name="submitseed" param="submitSeedParams" returnType="data_hex_string">
            <errors>
                <error value="UnsupportedUnityFeature"/>
            </errors>
        </method>
        <method name="submitsignature" param="submitSignatureParams" returnType="bool">
            <errors>
                <error value="UnsupportedUnityFeature"/>
                <error value="BlockTemplateNotFound"/>
            </errors>
        </method>
        <method name="ops_getBlockDetails" param="blockSpecifier" returnType="blockDetails">
            <comment>Returns the details of the specified block.</comment>
        </method>
        <method name="getblocktemplate" param="voidParams" returnType="blockTemplate"/>
        <method name="submitblock" param="submitBlockParams" returnType="submissionResult">
            <errors>
                <error value="BlockTemplateNotFound"/>
                <error value="FailedToSealBlock"/>
            </errors>
        </method>
        <method name="validateaddress" param="addressParams" returnType="validateAddressResult"/>
        <method name="getDifficulty" param="voidParams" returnType="big_int_hex_string"/>
        <method name="getMinerStats" param="addressParams" returnType="minerStats">
            <errors>
                <error value="FailedToComputeMetrics"/>
            </errors>
        </method>
    </methods>
</rpc>